{
  "schema_version": "aud-quality-gate-result-v1", "gate_result_id": "QG-FIXTURE", "suite_id": "CALSUITE-FIXTURE", "suite_version": "1.0.0", "policy_version": "1.0.0", "threshold_hash": "0000000000000000000000000000000000000000000000000000000000000000", "generated_at": "2026-01-01T00:00:00.000Z", "evaluator": { "name": "fixture", "version": "1.0.0", "source_revision": "abcdef1" }, "verdict": "pass", "hard_failures": [], "warnings": [], "informational": [], "baseline_comparison": { "status": "not_supplied", "improvements": [], "regressions": [], "unchanged": [], "new_cases": [], "incompatibilities": [] }, "policy_changes": []
}
